name,price
Converse Chuck Taylor Move low in coral,£70.00
Converse Chuck Taylor Lift in golden yellow,£60.00
Converse Chuck Taylor Move in white with a light pink detail,£70.00
Converse Chuck Ox with sole floral print in white,£75.00
Converse Unisex Run Star Hike trainers in white,£76.50
Converse Run Star Motion trainers in white,£100.00
Converse Chuck Taylor Lift in black with a blue detail,£70.00
Converse Run Star Hike in himalyan pink,£72.00
Converse Lugged 2.0 trainers in cream,£67.50
Converse Chuck Taylor Mystic World Leopard Print trainers in brown,£62.00
Converse Chuck Taylor Extreme Lift trainers in himalayan lilac,£75.00
Converse Run Star Hike trainers in neutral leather,£100.00
Converse Chuck Taylor All Star Hi trainers in pink,£57.00
Converse Run Star Hike crater trainers in cream,£100.00
Converse Lugged 2.0 trainers in triple black,£72.00
Converse Chuck Taylor lift leopard print trainers in multi,£63.75
Converse Chuck '70 Ox trainers in black,£70.00
Converse Run Star Hike trainers in brown with white sole,£100.00
Converse Chuck Taylor ox polka dot trainer in white,£47.60
Converse Run Star Hike unisex white trainers,£90.00
Converse Run Star Hike unisex black trainers,£90.00
Converse Chuck Taylor All Star Lift trainers in pink,£65.00
Converse Chuck Taylor in denim,£65.00
Converse Chuck Taylor Ox trainers in flamingo pink,£52.00
Converse Chuck 70 hi trainers in yellow,£75.00
Converse Chuck Taylor lift trainers in leopard,£75.00
Converse Chuck Taylor Move trainers in beige,£70.00
Converse Chuck 70 Hi recycled canvas trainers in red,£75.00
Converse Chuck Taylor lift trainers with floral details in white,£75.00
Converse Chuck Taylor Lift comfort in off white,£75.00
Converse Run Star Hike trainers in black,£90.00
Converse Chuck Taylor Move platform hi trainers in white,£70.00
Converse Chuck '70 Hi black trainers,£75.00
Converse Chuck Taylor All Star Dainty trainers in black,£44.20
Converse Chuck '70 Hi Sunflower yellow trainers,£75.00
Converse Chuck Taylor All Star Ox black trainers,£52.00
Converse Chuck Taylor All Star Ox white monochrome trainers,£52.00
Converse Chuck Taylor hi trainers in triple white,£57.00
Converse Chuck '70 Lo black trainers,£70.00
Converse Chuck Taylor All Star Hi black monochrome trainers,£57.00
Converse Chuck Taylor All Star Hi white leather monochrome trainers,£70.00
Converse Chuck Taylor All Star Ox black leather trainers,£55.25
Converse Chuck Taylor All Star Ox black leather monochrome trainers,£65.00
Converse Chuck Taylor All Star Ox white leather trainers,£65.00
Converse Chuck Taylor All Star Hi white leather trainers,£70.00
Converse Chuck Taylor All Star Ox white leather monochrome trainers,£55.25
Converse Chuck Taylor All Star Hi black leather trainers,£70.00
Converse Run Star Hike black trainers,£90.00
Converse Chuck Taylor All Star hi crater foam trainers in red,£59.50
Converse Chuck Taylor All Star hi crater foam trainers in green,£55.25
Converse Chuck Taylor All Star hi crater foam trainers in grey,£63.75
Converse Chuck Taylor ox polka dot trainer in black,£42.00
Converse Chuck Taylor All Star Lift trainers in leopard print,£56.00
Converse Chuck 70 Hi snake print trainers,£44.00
Converse Run Star Hike faux fur lined leather trainers in off white,£71.50
Converse X Gortex Chuck 70 hi logo waterproof trainers,£57.00
Converse Run Star Hike white trainers,£58.50
Converse Chuck 70 Low trainers in grey snake print,£46.75
Converse Chuck 70 Hi trainers in brown snake print,£54.00
Converse Chuck '70 Ox leather snakeskin trainers in pink,£44.00
Converse Run Star Hike trainers in triple white,£72.00
Converse Chuck taylor low trainers in pink heart print,£45.60
Converse Chuck Taylor All Star core white ox trainers,£50.00
Converse Chuck '70 Hi parchment trainers,£75.00
Converse Chuck Taylor All Star Hi white trainers,£57.00
Converse Chuck Taylor All Star Hi black trainers,£57.00
Converse Chuck Taylor All Star Ox black monochrome trainers,£44.20
Converse Chuck '70 Ox Trainers In Cream,£49.00
Converse All Star high top white trainers,£55.00
Converse Pro Leather trainers in off white with beige laces,£75.00
Converse Chuck Taylor All Star Ox white trainers,£52.00
Converse Wide Fit Chuck Taylor All Star Ox black trainers,£52.00
Converse Chuck Taylor All Star trainers in leopard print,£62.00
Converse Chuck Taylor Dainty Trainers in White,£52.00
Converse Chuck Taylor lift trainers in beige broderie anglaise,£80.00
Converse Wide Fit Chuck Taylor All Star Ox white trainers,£52.00
Converse Wide Fit Chuck Taylor All Star Hi white trainers,£57.00
Converse Chuck Taylor lift sunshine trainer in orange,£75.00
Converse Chuck Taylor lift sunshine trainers in white,£70.00
Converse Chuck 70 Low recycled canvas trainers in cream,£70.00
Converse Chuck 70 Hi in off white sunflower print,£62.00
Converse Chuck Taylor Lift in Khaki,£75.00
Converse Chuck Taylor Ox PRIDE Trainers in White,£57.00
Converse Chuck Taylor Hi PRIDE Trainers in multi,£62.00
Converse Chuck 70's with sole floral print in black,£80.00
Converse Chuck Taylor comfort in off white,£62.00
Converse Chuck Taylor All Star Hi in black Leather ,£70.00
Converse Chuck Taylor Move platform hi trainers in black,£70.00
Converse Run Star Hike Ox trainers in white,£72.25
Converse Chuck Taylor lift with leopard laces in black,£70.00
Converse Chuck 70 Hi floral embroidered trainers in blue,£80.00
Converse Chuck 70 Hi trainers in red print,£75.00
Converse Chuck Taylor Hi ditsy floral trainer in lilac,£62.00
Converse Chuck Taylor Hi Lift Platform white trainers,£65.00
Converse Chuck Taylor Ox platform black trainers,£65.00
Converse Run Star Motion trainers in black,£100.00
Converse Chuck Taylor Ox platform white trainers,£65.00
Converse Chuck Taylor All Star Ox in white Leather ,£65.00
Converse Chuck Taylor Hi Lift Platform black trainers,£70.00
Converse Run Star Hike trainers in coral pink,£90.00
Converse Chuck Taylor lift trainers in white broderie anglaise,£75.00
Converse Chuck 70 Low floral embroidered trainers in white,£63.75
Converse Chuck Taylor Hi in flamingo lilac-pink,£57.00
Converse Chuck 70 Hi PRIDE Trainers in white,£85.00
Converse Run Star Hike PRIDE Trainers in white,£61.20
Converse Chuck 70 with canvas floral print in yellow,£40.00
Converse Chuck Taylor All Star Move ox trainers in black,£65.00
Converse Run Star Hike Ox trainers in black,£85.00
Converse Chuck Taylor Dainty Trainers in Black,£52.00
Converse Chuck 70 Mystic World Future is Bright trainers in off white,£80.00
Converse Chuck Taylor Hi Move trainers in black,£70.00
Converse Chuck Taylor Hi Move in white,£70.00
Converse Chuck Taylor Ox platform in white ,£65.00
